Unnamed: 0,link,location,summary,title,tag,raised,goal,created_date,goal_int,raised_int
381,https://www.gofundme.com/getbackontrackgd,"Miami, FL","Salutations!  Thank you for taking the time to read about my adversities, and even considering donating to my cause. My name is Geisel Dieguez, and I'm a Cuban-Ecuadorian, nineteen year-old who graduated from Coral Gables Senior High School this past May. I have a deep love for public service, an...",Get Back On Track,dem,229,7000                    ," December 26, 2018",7000.0,229.0
382,https://www.gofundme.com/2at6exg,"Spokane, WA","Dear Friends, I’m writing to seek your support, as a National Delegate for Hillary Clinton with plans to attend the Democratic National Convention in Philadelphia, PA. I’m very proud to represent the 5th Congressional District of Washington State as Hillary’s delegate, covering 11 Counties in Eas...",Send Yvette Joseph to the DNC,dem,3768,3500                    ," June 22, 2016",3500.0,3768.0
383,https://www.gofundme.com/eloisatodnc,"Norwalk, CT","My name is Eloisa Melendez. I'm a 22 year old Latina college student and councilwoman in Norwalk, CT.  I'm a pledged PLEO (Party Leaders and Elected Officials) delegate to the 2016 Democratic National Convention for Senator Bernie Sanders.   As a young progressive elected official, I'm inspired b...",Help Eloisa's Delegate Costs,dem,3790,3000                    ," June 25, 2016",3000.0,3790.0
384,https://www.gofundme.com/fund-my-campaign-for-office,"Green Brook, US","Dear Friends- Last year I dipped my toes into the waters of local politics and ran for Township Committee Member in my hometown of Green Brook, NJ. It was my first foray into the world of politics and the experience was at once enlivening and exhausting.  It was wonderful learning all of the geog...",My Campaign for Office,dem,925,1400                    ," September 17, 2017",1400.0,925.0
385,https://www.gofundme.com/marisolsjd,"New Brunswick, NJ","My name is Marisol Conde-Hernandez. The above video is the first episode of a serial documentary about my family and I, produced by Talking Eyes Media and a project of Newest Americans .   I have a deep-rooted, long term commitment to social justice & civil rights and I joined the Rutgers School...",Pursuing a J.D. for Social Justice,dem,7125,40000                    ," December 1, 2015",40000.0,7125.0
386,https://www.gofundme.com/JohnArcherPhilly20,"Fort Lauderdale, FL","My Name is John Archer. I have been a lifelong Democrat since at least May 4th, 1970, when at age 13, I heard about the shootings of 4 Kent State students protesting the Vietnam War. I have voted Democrat and Progressive ever since I was able to cast my first vote for Jimmy Carter in 1976. I have...",ForwardMarch,dem,1650,2500                    ," May 22, 2016",2500.0,1650.0
387,https://www.gofundme.com/2br3s7w,"Dallas, TX","I was elected to attend the Democratic National Convention and it would be an honor if you supported my efforts to attend the convention by making a contribution.  This year's convention will be held in Philadelphia from July 24 to July 29th.  However, the convention costs are preset by the Natio...",Send Shay to DNC 2016!,dem,2165,2000                    ," June 28, 2016",2000.0,2165.0
388,https://www.gofundme.com/27hcp7w7,"Cheyenne, WY","I feel very honored and privileged to represent Wyoming as a National Delegate for Secretary (not to mention former Senator and First Lady) Hillary Clinton. I was very proud to stand with former Wyoming Secretary of State, Kathy Karpan, to nominate Secretary Clinton to be our next President of th...",Send Mike to Philly for Hillary!,dem,2100,2000                    ," June 1, 2016",2000.0,2100.0
389,https://www.gofundme.com/2abwttg,"Columbus, OH","Hello fellow Bernie supporters! I'm Mayo Makinde, Ohio's NEWEST National Delegate for Bernie Sanders and I'm raising funds to go to Philadelphia to represent Sen. Sanders at the 2016 Democratic National Convention.  I was appointed as Bernie's ONLY alternate delegate for the whole state! Then, a...",NEW Ohio Bernie Delegate to Philly,dem,1526,1500                    ," June 20, 2016",1500.0,1526.0
390,https://www.gofundme.com/2p8scc55,"Rochester, NY","UPDATE: Finished Cayuga Lake Aug. 21; all 11 lakes completed, and my fundraising goal met! Click here for my blog posts. I'm Justin Murphy, a newspaper reporter for the Democrat and Chronicle in Rochester, New York. I've been lucky to live in the Finger Lakes region  of upstate New York for most...",Finger Lakes Tour,dem,3246,3000                    ," April 29, 2016",3000.0,3246.0
391,https://www.gofundme.com/2bbkrb4k,"Boise, ID",Being Democrats... our other full time jobs... Van and Chelsea are proud Idaho Democrats who work tirelessly to make this great state even greater! Holding positions with the Democratic party in the state of Idaho has proven to keep them both significanly busy. The duties of working towards the m...,Beechlinc goes to Philly!,dem,3731,4000                    ," June 25, 2016",4000.0,3731.0
392,https://www.gofundme.com/StandRockSupply,"Boulder, CO","(Pic from Hueco Tanks, TX)  Why does Standing Rock matter? Because abuse of Native Americans is not a thing of history. It is current, alive, and it is ours to deal with. If we do not act, we are compliant with those abuses.  And because our water is our life. We must start paying attention to ho...",On-going Support for Standing Rock,dem,2843,5000                    ," September 6, 2016",5000.0,2843.0
394,https://www.gofundme.com/tothednc,"Lakewood, OH",The movement continues!!! AND BERNIE STILL NEEDS YOU!!   I need your help to get to the DNC. I'm a Pledged Delegate for Bernie Sanders and worked for the Senator the last few months as a field organizer.  The Democrat Party makes this very expensive and will likely cost $2000 or more. Anything yo...,Send a Bernie Delegate to the DNC,dem,2250,2250                    ," June 9, 2016",2250.0,2250.0
395,https://www.gofundme.com/get-kelly-to-venice,"Natchez, MS","Kelly’s story   Mr. Kelly Phillips, who has been struggling with cancer, began a whirlwind trip in 2017 down the Mississippi River from Wisconsin, and made it to his destination of Venice, LA. Due to issues with his houseboat, he was been stuck in Natchez, MS for a month; he is still in Venice do...",Get Kelly down the Mississippi,dem,1965,3000                    ," August 20, 2018",3000.0,1965.0
397,https://www.gofundme.com/march-for-our-lives-bus-trip-to-dc,"Berlin, MD",Enough is Enough!  Will you please consider helping the Young Democrats of Worcester County sponsor a bus for our local youth to attend the March For Our Lives in DC on March 24th?  A roundtrip coach bus costs approximatley $2700.  We want all students and youth who want to attend be able to affo...,March For Our Lives Bus Trip to DC,dem,2130,2000                    ," February 19, 2018",2000.0,2130.0
398,https://www.gofundme.com/mateoforhillary,"Dallas, TX","(TL;DR in bold)  My name is Matthew Leahy, friends call me Matt or Mateo.  Not everyone finds their calling when they are in Junior High. In 2008, I realized that I had a passion for Democratic politics. I wanted to learn to use the gifts and talents and the education I had to become the most eff...",#ThumbsUp for Matt #MISheCan,dem,2615,3000                    ," July 16, 2016",3000.0,2615.0
399,https://www.gofundme.com/juana-salgado,"Santa Rosa, CA","My name is Suleima --With the permission of Juana Salgado— I (her daughter in law) am asking for help. She and her three kids recently lost their home and pet dog, due to a tragic fire that broke out in their home and left them with nothing. Although, they are thankfully okay, her three children...",Family lost everything in fire,dem,4100,5000                    ," September 5, 2016",5000.0,4100.0
400,https://www.gofundme.com/25uct944,"Woodinville, WA","Hi everyone,  My name is Cat Williams and I am the young democrat representative of the 45th legislative district, and am also on the executive board of the King County democrats. On May 21, I had the honor of being elected to be a national delegate for Bernie Sanders. This means I will get to re...",Help Cat get to the DNC for Bernie,dem,2395,3000                    ," May 24, 2016",3000.0,2395.0
401,https://www.gofundme.com/Shaughnessy4Mayor,"Westbrook, ME","New Vision...Solid Leadership!  My name is Michael Shaughnessy. And I am asking for your vote this November and your support to be the next Mayor of Westbrook, Maine. Join me in working for the future of our city.  Westbrook is a city of vast potential. It has a burgeoning downtown, a beautiful r...",Shaughnessy for Mayor of Westbrook,dem,3125,3000                    ," September 16, 2016",3000.0,3125.0
402,https://www.gofundme.com/keysdelegate,"Key West, FL",Thank you for visiting my gofundme campaign. I have recently been elected by Democrats in District 21 of Florida to represent them as a Delegate for Bernie Sanders at the Democratic Convention in Philadelphia on July 25th.   I believe I will have an opportunity to raise non-partisan awareness abo...,Keys Dem Delegate to Philly 7-25,dem,3512,5000                    ," May 10, 2016",5000.0,3512.0
403,https://www.gofundme.com/adems-ad39,"Sun Valley, CA","Funds go to: Outreach material + travel expenses  We are the Progressive Candidates running for seas in California's  Assembly District 39, in the Northeast San Fernando Valley! Every two years, the CA Democrats elect 7 self-identified females and 7 other than self-identified females from each As...",AD39 SFV Progressives - ADEM Delegate Candidates,dem,1239,2000                    ," January 6, 2019",2000.0,1239.0
404,https://www.gofundme.com/25n2dn55,"Whittier, CA","HOLD ON!  We are going to the convention to fight!    Bernie will be there and we, his pledged delegates, as well.  We will have a roll call vote.  I pledged to vote for him and I will.  He will speak and I will be there to support him.  It's a time of great wonderment and flux, to be sure, but...",Honoring our Pledges and Bernie,dem,2200,2200                    ," May 19, 2016",2200.0,2200.0
405,https://www.gofundme.com/karen-reed039s-funeral-costs,"Johnstown, PA","On Saturday  October 20th, the lord took the most selfless person on this Earth. Karen Reed gave so much to the community, every year she dontated hundreds of dollars to the Santa fund, Saint Vincent Depauls, and most importantly her favorite Saint Jude's Children's Hospital. Everyone knew my aun...",Karen Reed's Funeral Costs,dem,55,8000                    ," October 22, 2018",8000.0,55.0
406,https://www.gofundme.com/help-for-nikki-house-fire-relief,"Windsor, CA","Nicole – Daughter to Richena Johnson,  has lost her apartment in the W. Steele lane fire last week.   Nikki, her husband (Neal), and their daughter (Abby), have lost all of their belongings due to the fire/smoke damage.  Santa Rosa apartment fire displaces 140, causes $500,000 in damage  (Photo C...",Help for Nikki : House Fire Relief,dem,3813,5000                    ," April 10, 2019",5000.0,3813.0
408,https://www.gofundme.com/SDYDDNC2016,"San Diego, CA","Hey Everyone,   As you know, Kelvin Barrios, Daniel Firoozi and myself (Will Rodriguez-Kennedy) were elected to be pledge delegates and alternates to the DNC Convention in 2016 for Hillary Clinton. It's a huge honor.   When we go to convention we will be part of the most diverse delegation, Danie...",Send San Diego YDs to DNC2016,dem,6081,6000                    ," June 22, 2016",6000.0,6081.0
409,https://www.gofundme.com/sergiolopezdnc2016,"San Jose, CA","My name is Sergio Lopez and on May 1, I won election as a delegate to the 2016 Democratic National Convention, I'm the youngest person representing our district, CD-18, as part of the California delegation to the convention, but I need your help!  I've been involved in politics at both the local...",Help support Sergio for DNC 2016!,dem,3890,4500                    ," May 18, 2016",4500.0,3890.0
410,https://www.gofundme.com/29pmnas,"Helena, MT","Welcome to my 'Mr. Lockridge goes to Philly' GoFundMe page!  Thank you for taking an interest in this amazing, (perhaps more than) once-in-a-lifetime opportunity. Here's the scoop for those of you just tuning in:   I was selected to attend the Democratic National Convention (DNC) in Philadelphia...",Mr. Lockridge goes to Philly (DNC),dem,2390,2500                    ," June 15, 2016",2500.0,2390.0
412,https://www.gofundme.com/brittanyfordnc,"Salem, OR","My name is Brittany MacPherson and I am by far one of the most ardent Hillary supporters you will meet. I am currently a grad student at Oregon State, AFT union steward, Marion County Young Democrats Chair, Founder of Salem for Hillary, HUGE supporter of progressive candidates & causes, and overa...",Brittany's DNC Adventure!,dem,2046,2016                    ," June 19, 2016",2016.0,2046.0
413,https://www.gofundme.com/funeral-fund-for-jim-wilson-jr-petalumas-finest,"Guerneville, CA","Jim wasn’t expected to live past the first two years of his life, but in the face of all medical odds, he made it past his 62nd birthday, and made a wonderful impact in his hometown of Petaluma, CA. Our family is pooling resources to raise funds to cover the cost of the funeral and obituary in th...",Funeral Fund for Jim Wilson Jr.,dem,3435,5000                    ," April 4, 2018",5000.0,3435.0
414,https://www.gofundme.com/65001s0,"Austin, MN",Some things to think about when you read about Anthony. He spent years as a volunteer for the democrat party. Logged 500+ hours a year volunteering for the Salvation Army. Volunteered on every habitat for humanity project in mower county. Took in 6 children over the last 20 years and raised them...,Earles Family Fund,dem,1805,4000                    ," September 18, 2018",4000.0,1805.0
416,https://www.gofundme.com/the-john-wood-heartattack-recovery-fund,"Redmond, OR","On the morning of May 29th 2019 my uncle John Wood (age 71) of Albany, Oregon suffered a massive heart attack. It started with difficulty breathing and pain in his arm, which John described as feeling like an elephant was sitting on his chest. He was rushed to the hospital where he underwent an a...",The John Wood Heart-Attack Recovery Fund,dem,1285,10000                    ," May 30, 2019",10000.0,1285.0
418,https://www.gofundme.com/tamborine4Bernie,"Yelm, WA","At the Washington State 10th Congressional District Caucus on May 21, 2014 five delegates were elected to represent Bernie Sanders at the 2016 Democratic National Convention in Philadelphia, PA. Out of the five, there were three women from Thurston County. Tamborine Borrelli was one of those 3 wo...",Send Tamborine to Philly for Bernie,dem,2044,3200                    ," June 10, 2016",3200.0,2044.0
419,https://www.gofundme.com/sendbrucetophilly,"Rochester, MI","I have more information about my trip to Philly and my likely expenses, so I've lowered my goal in accordance with that information.  My name is Bruce Fealk.  I've been a life long Democrat and I can't even contain my excitement today. I'm 62 years old and I've never been to a Democratic conventi...",Send Bruce to Philly for Bernie,dem,1600,1600                    ," May 21, 2016",1600.0,1600.0
421,https://www.gofundme.com/79udagh8,"Santee, CA","Hi, Friends:  I'm Cindy.  You probably know me from the San Diego Democrats for Equality, my activism on choice, or my honor as a Friend of Pride in the San Diego LGBT Pride Parade in 2013.  On Monday my Mom died.  It was coming, but we never knew when.   Now that day arrived.  I feel so alone....",Cindy's Mom's funeral home expenses,dem,5490,5000                    ," March 15, 2016",5000.0,5490.0
424,https://www.gofundme.com/264f85md,"Orlando, FL","Dear Friends, On May 7, 2016, I was elected by Democrats in my congressional district to serve as one of the National Delegates to represent Florida at the Democratic National Convention (DNC) in Philadelphia, PA.  It is a great honor to be a member of the Florida Delegation who will travel to th...",Help send Brandon to the 2016 DNC!!,dem,2015,2500                    ," May 25, 2016",2500.0,2015.0
425,https://www.gofundme.com/2aqy8y4,"Albuquerque, NM","Hello Friends!   As you may have read on my Facebook page, I was recently elected to represent New Mexico's CD 1 as a pledged delegate for Hillary Clinton at the upcoming DNC Convention in Philadelphia.  This is incredibly exciting -- being able to be a small part of nominating the first woman as...",Help Send John to Philadelphia!,dem,2077,2000                    ," June 22, 2016",2000.0,2077.0
428,https://www.gofundme.com/k6k470,"Parlin, NJ",A good friend of mine just experienced losing everything he has due to a fire that took his apartment. Looking to help him get back on his feet with the help of others. Anything will help. http://www.nj.com/hunterdon-county-democrat/index.ssf/2015/01/high_bridge_fire_leaves_two_cats_missing_all_r...,Help Jordan,dem,2440,3000                    ," January 14, 2015",3000.0,2440.0
429,https://www.gofundme.com/SendAlexsis2DNC,"Richmond, VA",I am humbled and excited to have been elected to represent Virginia's 3rd Congressional District at the 2016 Democratic National Convention in Philadelphia.   I hope that I can count on your support to get me there.  2016 is a big year for Virginia Democrats. In addition to keeping a Democrat in...,Send Alexsis to the DNC in Philly,dem,2155,2000                    ," May 27, 2016",2000.0,2155.0
431,https://www.gofundme.com/ask-john-moolenaar,"Midland, MI","A year ago, local citizens challenged our Congressman, GOP Representative John Moolenaar, to host a townhall meeting where citizens could voice concerns. That meeting was very successful for citizens, but not comfortable for Mr. Moolenaar. It is not likely he will do it again during this election...",Ask John Moolenaar,dem,1940,3000                    ," February 14, 2018",3000.0,1940.0
432,https://www.gofundme.com/volunteering-in-nevada-for-dems-2ub6yw84,"Oakland, CA","Hey guys! As you may know, we, Deirdre and Abby, have been in Las Vegas volunteering full time for the democratic party. We’ll be here up until election day. It’s a crazy, super emotional, exhausting (14 hours a day, 7 days a week!), fantastic experience. We’re not just fighting for Hillary, but...",Volunteering in Nevada for Dems,dem,4269,5000                    ," October 15, 2016",5000.0,4269.0
433,https://www.gofundme.com/powdered-wig-society,"Dallas, TX","The liberals who run the social media giants have openly discriminated against conservative publishers since the election of President Trump, as we were instrumental in his 2016 presidential election. Candidate Trump tweeted one of my articles to the world in February 2016. Facebook, Twitter, and...",Help us fight Facebook,dem,525,150000                    ," October 8, 2018",150000.0,525.0
434,https://www.gofundme.com/lilystriptodc,"East Chicago, IN","I am currently a senior at Bishop Noll Institute and have been chosen to represent my school and community at the 2017 Presidential Inauguration Leadership Summit. This prestigious Summit will take place next January in Washington, DC, inspired by the inauguration and the issues that face next ge...",My Presidential Inauguration Summit,dem,3376,4212                    ," April 16, 2016",4212.0,3376.0
437,https://www.gofundme.com/catala-for-council-ward-9-fund,"Providence, RI","Good day family and friends, I'm reaching out to you I hopes you are ""STILL, Serious About Change"" and want to make a difference in ward 9 and the capital city as a whole. I'm asking that you ""Declare your Independence"" by voting for change in the failed leadership of the pass several years. As w...",Catala for Council Ward 9 Fund,dem,155,9000                    ," July 2, 2018",9000.0,155.0
438,https://www.gofundme.com/GeorgeForPhilly,"Anchorage, AK","Hi,  My name is George W Sookiayak, I am an Inupiaq Alaska Native and I am a National Delegate from Alaska House District 25 located in Anchorage Alaska.  I am attending the Democrat National Convention in Philadelphia PA as a delegate for Bernie Sanders.  Travelling out of Alaska is always a log...",AK 2 Philly - Democratic Convention,dem,1750,1750                    ," April 21, 2016",1750.0,1750.0
439,https://www.gofundme.com/26um953g,"Orchard Park, NY",Hi Friends and Family!  I am an elected delegate to the Democratic National Convention - representing Bernie Sanders - in the city of brotherly love -  Philadelphia!   I have been a staunch progressive Democrat for most of my life and will continue to advocate for the Bernie Platform long after t...,Help Kate get to the DNC! CD 27,dem,1750,1500                    ," May 28, 2016",1500.0,1750.0
440,https://www.gofundme.com/jessica2016DNC,"Jackson, WY","Hello friends! I am fundraising for my trip the 2016 Democratic National Convention as a National Delegate for Bernie Sanders. I am thrilled to be able to do this amazing thing for my fellow Wyoming Democratic Bernie supporters, Wyoming Democrats, Women, and Youth. This is the first round of fund...",Send Jessica to the DNC for Bernie!,dem,1920,2500                    ," June 5, 2016",2500.0,1920.0
441,https://www.gofundme.com/jefftodnc,"Dallas, TX",I was elected as a delegate to the Democratic National Convention and it would be an honor if you supported my efforts to attend the Democratic National Convention by making a contribution.  The convention this year will be held in Philadelphia from July 24 to July 29th. The convention costs for...,Send Jeff to Philly! DNC 2016.,dem,3985,3400                    ," June 26, 2016",3400.0,3985.0
442,https://www.gofundme.com/1nxclsc0k0,"Denver, CO","As a delegate, I will be traveling to Indianapolis to represent Colorado at the Young Democrats National Convention. This event provides each attendee with many opportunities to build up their leadership skills and training on a variety of topics that I will be back to Colorado. I would love to h...",Delegate to Young Dems of America Convention,dem,860,1600                    ," June 11, 2019",1600.0,860.0
443,https://www.gofundme.com/chimeneforjustice,"Houston, TX","Welcome, and thank you for taking time to inquire and consider voting and contributing to a fellow citizen.  Michele Chimene is running to be an Appeals Justice for Position 8 in the 14th Court of Appeals. She has 25 years experience in appellate law, handling both civil and criminal matters. She...",Michele Chimene for Justice,dem,2091,40000                    ," June 13, 2017",40000.0,2091.0
444,https://www.gofundme.com/29jsz3w,"Canton, MI","My name is Ethan Petzold and I'm the youngest member of Michigan's Delegation to the Democratic National Convention this year, and the youngest delegatge ever for Democrats from the State of Michigan!   As many of you know, going to the Convention is very expensive and there is still some money I...",Help Ethan cover Convention costs!,dem,1800,2500                    ," June 22, 2016",2500.0,1800.0
446,https://www.gofundme.com/625wqj4,"Conroe, TX","Jay Stittleburg (USN), Mike Midler (USMC), and John-Brandon Pierre (USMC) are proud to announce that we have formed a coalition of Military Veteran Candidates who are 1) Democrats and 2) The ONLY Veterans running for office in Montgomery County. We have pooled our limited funds (and hopefully som...",Military Veterans Election Billboard,dem,775,5000                    ," September 3, 2018",5000.0,775.0
447,https://www.gofundme.com/2cz4kx2k,"Pearland, TX","Hello Friends and fellow Democrats,  I am Robert Williams, Messaging Committee Chairman for the Texas Coalition of Black Democrats. I attended the Texas Democratic Party State Convention in San Antonio, in June where we worked to communicate and advocate a number of key issues that are affecting...",Robert Williams National Delegate,dem,1635,3500                    ," June 29, 2016",3500.0,1635.0
448,https://www.gofundme.com/27fm59v8,"Neah Bay, WA","Your support is needed and appreciated:  Need to raise $3,500 travel funds to attend the DNC Convention in Philadelphia July 24-29, 2016 Back ground information:  Elected Washington State Democrat Delegate to the DNC Philadelphia Convention. July 2016  Elected Washington State Elector College Rep...",WA State Dem Delegate to DNC 2016,dem,1787,3500                    ," June 1, 2016",3500.0,1787.0
450,https://www.gofundme.com/DNCforKC,"Tupelo, MS","KC CALDWELL GRIST A Tupelo, Mississippi native,  I come from a long line of Democratic public servants. My great-grandfather, two grandfathers, father, brother and husband have held elected office.  Now I have been elected to follow in my grandfather Gilbert Mayer’s footsteps and serve as a deleg...",KC's DNC Trip,dem,5350,5000                    ," June 6, 2016",5000.0,5350.0
451,https://www.gofundme.com/alex2philly,"Lincoln, NE","Hello to all my friends, family, and progressives all over America!  My name is Alex, and just a few days ago I was elected by all the county-level Bernie delegates from Nebraska's First Congressional District as Nebraska's only male alternate to the Democratic National Convention next month in P...",Send Alex to Philly for the DNC!,dem,2000,2000                    ," June 21, 2016",2000.0,2000.0
452,https://www.gofundme.com/socialistcongress,"Santa Cruz, CA","SEND A  SOCIALIST TO CONGRESS!  Sam Farr is retiring. The 20th District congressional seat is open. Jimmy Panetta, Leon Panetta's son, has basically claimed the seat by birthright alone. The Panetta name scared off more worthy replacements for the office and no other Democrat will run against him...",Joe Williams for Congress,dem,2040,4999                    ," January 7, 2016",4999.0,2040.0
