Unnamed: 0,link,location,summary,title,tag,raised,goal,created_date,goal_int,raised_int
0,https://www.gofundme.com/steven-crowder-live-at-smu,"Dallas, TX","SMU College Republicans is bringing comedian Steven Crowder to SMU on Thursday, March 22 at 7pm in McFarlin Auditorium. Due to an extremely high demand to see Louder with Crowder live at SMU, we are renting the largest venue on SMU's campus. Unfortunately, the need to use McFarlin has significant...",Steven Crowder Live at SMU!,rep,2710,6500                    ," March 7, 2018",6500.0,2710.0
1,https://www.gofundme.com/reopen-a-nc-republican-office-2ukuprzy,"Brookline, MA","NOTE: We reached our goal and then some in less than 40 minutes after we went public with this campaign. We stopped accepting donations then because our aim is to fund re-opening the bombed-out office, and we decided that we had gathered a reasonable amount for that purpose.   There are many wort...",Dems help reopen a NC Repub office,rep,12857,10000                    ," October 16, 2016",10000.0,12857.0
3,https://www.gofundme.com/mugop,"Columbia, MO","We are the University of Missouri - College Republicans.  As you may have seen in recent news, it has become more and more difficult to voice our opinions freely on campus.  It is now legal to report ""hateful and/or hurtful speech"" to Mizzou's police department.       We are asking for your suppo...",Mizzou College Republicans,rep,3649,5000                    ," November 17, 2015",5000.0,3649.0
4,https://www.gofundme.com/bennett-funeral-expenses,"Nashville, TN","Steve Willis, brother of Karen Willis Bennett, and son of Loretta Willis, passed away on November 13,2017. Steve had suffered from numerous medical issues for several years and his only income was from disability with limited support from Karen and her Mom. Karen’s father, Donald Willis, died jus...",Willis (Bennett)  Funeral Expenses,rep,1575,8000                    ," November 15, 2017",8000.0,1575.0
5,https://www.gofundme.com/rgep2s,"Peoria, IL","Hello everyone. I'm Jesus, the Son of God. Support my loyal friend Ed as he sets the historical record straight by re-writing the Gospels and other key books of the New Testament through the lens of modern Republican Christianity (""Christianity""). Basically, he's going to take the situations in w...",The New Republican Bible,rep,2625,1000                    ," April 9, 2015",1000.0,2625.0
6,https://www.gofundme.com/62otugo,"Goshen, KY","This years NOHS Young Republican’s Club is the biggest in school history with 35 members and is continuing to grow. With a club this size we are seeking funds to be able to provide food for meetings, take club trips, and provide club t-shirts for all members. Any donation helps and will be greatl...",NOHS Young Republican’s Club,rep,500,750                    ," September 5, 2018",750.0,500.0
7,https://www.gofundme.com/help-repair-our-club,"New York, NY","Late last night, in an act of what can only be described as malice and domestic terrorism, a group of Antifa members vandalized our historical, grassroots club, in Manhattan's Upper East Side. Our doors were graffitied, windows smashed, and a note threatening future violence was left for the club...",Help repair our Club!,rep,4278,25000                    ," October 12, 2018",25000.0,4278.0
8,https://www.gofundme.com/templecrs,"Philadelphia, PA","The Temple University College Republicans is a student organization on the Temple University campus that is dedicated to promoting conservative and Republican ideals to the student body, in addition to combating and promoting the truth when it comes to liberalism and progressivism.  Proceeds will...",Temple College Republicans Fundraising Initiative,rep,502,500                    ," June 4, 2019",500.0,502.0
9,https://www.gofundme.com/keep-the-gay-republican-alive,"Austin, TX","Facebook & Twitter has done everything possible to shut me down. My Facebook account was deleted and my twitter was purged from 100K+ to 2k. Tell me that's not corporate censorship? For the last 6 years blogging has been my life. It paid the bills, and helped spread the message of Compassionate C...",Help Keep The Gay Republican Alive,rep,575,2500                    ," December 28, 2018",2500.0,575.0
10,https://www.gofundme.com/hillsdalecpac,"Hillsdale, MI",Hillsdale College Republicans aims to take students to the Conservative Political Action Conference (CPAC) every year in Washington D.C. Students are able to listen to a vast array of conservative speakers and often have opportunities to meet and connect with them. CPAC is a great place for stude...,CPAC-Hillsdale College Republicans,rep,1930,5000                    ," October 23, 2016",5000.0,1930.0
11,https://www.gofundme.com/25j9xngs,"Everett, WA","Update: I set my goal assuming a frugal and thrifty trip (splitting a hotel room three ways, choosing a less desirable flight time, etc.) and I'm not going to change my attitude because of your generosity. All extra funds will go toward fellow young, deserving delegation members. You can donate t...",Send Natalie to Republican Natl Con,rep,1595,1500                    ," May 23, 2016",1500.0,1595.0
13,https://www.gofundme.com/cpac-in-washington-dc,"Fairfield, CT","The Fairfield University College Republicans will be traveling to Washington DC in a few weeks to attend CPAC (Conservative Political Action Conference), with a total of 15 club members.  The costs for the trip are very high to cover travel and board and we are asking for donations. We hope that...",CPAC in Washington DC,rep,1575,3500                    ," February 5, 2017",3500.0,1575.0
14,https://www.gofundme.com/eckerd-college-republicans-club,"Saint Petersburg, FL","The Eckerd College Republicans are back in action after 30 years! We will be returning this coming spring, 2019.  We’re asking y’all for funding to get the club started back up again.  Funding will go towards hosting our own meetings, parties and events, traveling to major political events, going...",Eckerd College Republicans Club,rep,340,1000                    ," December 27, 2018",1000.0,340.0
15,https://www.gofundme.com/truman-young-republicans-fundraiser,"Levittown, PA","The Truman Young Republican’s Club consists of a group of about 15 responsible, motivated Truman High School students who wish to educate themselves and others about current political issues.  As a first-year organization, we have had limited opportunities for fund-raising. We would like to broad...",Truman Young Republicans Fundraiser,rep,245,2000                    ," February 8, 2019",2000.0,245.0
16,https://www.gofundme.com/send-megan-to-the-college-republican-convention,"Noblesville, IN","This April I was elected to serve the Florida Federation of College Republicans as the 2nd Vice Chairwoman. With this amazing opportunity, I was invited to attend the College Republican National Convention which happens biannually. This will be my last chance to attend this event that takes place...",Send Megan to the College Republican Convention,rep,315,500                    ," June 26, 2019",500.0,315.0
17,https://www.gofundme.com/florence-relief-republican,"Lexington, SC",100% of all proceeds go directly to the victims of hurricane Florence,Republicans for Hurricane relief,rep,475,1000                    ," October 15, 2018",1000.0,475.0
18,https://www.gofundme.com/3597xp9w,"Sioux Falls, SD","At Augustana University, students are leaders. Students strive to achieve the highest possible standard of community, excellence, leadership and diligence. As the Augustana University Republicans, we are no different. Almost all student groups at Augustana University are student funded. We volunt...",Augie Republicans Trip to CPAC,rep,2600,5000                    ," November 8, 2015",5000.0,2600.0
19,https://www.gofundme.com/sju-college-republicans-to-cpac-19,"Broomall, PA","The College Republicans at SJU have had a great presence in the Philadelphia area this year. SJU College Republicans were awarded the chapter of excellence and continue to maintain that status. The chapter has increased membership, tabled, and canvassed for local elections in both Philadelphia an...",SJU College Republicans to CPAC ‘19,rep,60,1500                    ," October 31, 2018",1500.0,60.0
20,https://www.gofundme.com/rncjacoballin,"Mississauga, ON","Hello!  As many of you know I'm a student at Carleton University majoring in Political Science.  In the past year and a half I have worked on many different political projects. These ranged from interning in a Minister's office, to becoming a canvass supervisor on the Mississauga-Lakeshore campai...",Jacob's Republican Convention Fund,rep,2331,2500                    ," June 21, 2016",2500.0,2331.0
21,https://www.gofundme.com/republican039s-for-foster-kids,"Benton, AR","Project Zero works to connect waiting families with waiting children in the Foster Care system.    Through a combination of events and the creation of short films families are created each year. However, each year more children enter the foster system. Project Zero hops that one day there will be...",Republican's For Foster Kids,rep,935,2500                    ," July 1, 2018",2500.0,935.0
22,https://www.gofundme.com/university-of-toledo-college-republicans,"Perrysburg, OH","We are raising money to send some of our members to CPAC in Washington DC at the end of February, where they can further their knowledge and leadership skills. Members will have the chance to see The President of The United States, Vice President, and many other conservative leaders. The trip wil...",University of Toledo College Republicans,rep,425,1000                    ," January 23, 2019",1000.0,425.0
23,https://www.gofundme.com/republican-st-ppatch-site-improvements,"Seattle, WA",summary was NoneType,Republican St. P-Patch Site Improvements,rep,971,12500                    ," May 22, 2019",12500.0,971.0
24,https://www.gofundme.com/college-republicans-at-ut-need-help,"Austin, TX","Help the College Republicans serve the UT Austin campus and keep Texas red for the decades to come! The next generation of Texan voters and leaders is walking around our campus right now, daily being fed a diet of leftist lies. If we want to keep Texas red, we need to make sure that conservatism...",College Republicans at UT need help,rep,1440,3000                    ," November 14, 2018",3000.0,1440.0
25,https://www.gofundme.com/cypress-city-council-republican,"Cypress, CA",Steven D. Bradley                                                              AGE: 63                                                                                                                                                        OCCUPATION: CPA/CFO Retired  I am a Republican.   I have be...,Cypress City Council,rep,3000,10000                    ," August 22, 2018",10000.0,3000.0
26,https://www.gofundme.com/dominic-republican-medical-assist,"Fuquay Varina, NC","Dear friends, family, peers, and other great influencers of my life,      I would first like to thank you for taking your time to read my letter. As many of you know, I plan to continue my education after high school by pursuing the medical field. Specifically, I would like to become a Physician’...",Dominican Republic Medical Assist,rep,340,4000                    ," November 16, 2018",4000.0,340.0
27,https://www.gofundme.com/college-republicans-at-ucsc,"Santa Cruz, CA","The College Republicans at UC Santa Cruz are proud to announce they will be raising funds for the 2019 - 2020 school year. With past support our community has made it possible to bring names like David Horowitz, Cabot Phillips, and Christina Hoff Sommers to UCSC. Going forward we hope to bring no...",College Republicans at UCSC,rep,25,3000                    ," May 23, 2019",3000.0,25.0
28,https://www.gofundme.com/uncw-college-republicans-cpac-2019-trip,"Oxon Hill, MD",Hello all! We are asking for donations to assist us with our annual trip to the Conservative Political Action Conference (CPAC) at the Gaylord National Convention Center in the National Harbor. CPAC 2019 is February 27 - March 2. CPAC is an opportunity for us to build connections with other conse...,UNCW College Republicans CPAC 2019,rep,865,2500                    ," November 27, 2018",2500.0,865.0
29,https://www.gofundme.com/bulldog-republicans-go-to-cpac,"Duluth, MN","Dear Fellow Republicans,      The Bulldog Republicans at UMD have had an eventful semester, and we are winding down after elections. There is still plenty of work to be done for us to further spread the conservative voice on campus. We have increased membership, tabled on campus, participated in...",Bulldog Republicans go to CPAC!,rep,1100,1500                    ," January 23, 2019",1500.0,1100.0
30,https://www.gofundme.com/college-republicans-ucsc-fund,"Santa Cruz, CA",The UCSC College Republicans want to bring you amazing speakers and events to our campus.  We need money to make this happen. Thanks for your generous support!,UCSC College Republicans Fundraiser,rep,125,5000                    ," January 29, 2018",5000.0,125.0
31,https://www.gofundme.com/young-republican-katelyn-mcguyer-needs-support,"Visalia, CA","Our niece, Katelyn, has been selected as an intern for our local congressman this summer in Washington D. C. Katelyn has demonstrated determination and a positive attitude interning in Hanford for Congressman Valadao while attending COS and working for Visalia Emergency Aid. She attended UC Berke...",Katelyn McGuyer needs support,rep,889,4000                    ," April 1, 2019",4000.0,889.0
32,https://www.gofundme.com/political-action-college-republicans,"Hartford, CT","College Republicans at Trinity College is launching a capital campaign! The money raised will be used to host speakers and events on campus. Also, funds will be used to provide basic operations for the club like providing food at meetings, fares for ubers to do door knocking and costs for marketi...",Political Action! College Republicans,rep,505,5000                    ," April 16, 2019",5000.0,505.0
33,https://www.gofundme.com/supportcsufgop,"Fullerton, CA","The CSUF Republicans seek to support conservative students, empowering them to be active on campus and in the community.  We've faced attacks from liberal student groups and ANTIFA. One our students was physically assaulted by a professor on campus. We were even sued by California Democrats. We n...",Support the CSUF Republicans!,rep,25,1000                    ," January 29, 2019",1000.0,25.0
34,https://www.gofundme.com/2019-fundraiser-for-cru,"Chandler, AZ","Formed in January of 2018, College Republicans United has already grown to be the largest Conservative student organization at Arizona State University. We are upbringing a new generation of Millennial Republicans to revitalize the Conservative base, that has been neglected until the Trump Era. C...",2019 Fundraiser for CRU,rep,700,3200                    ," November 7, 2018",3200.0,700.0
36,https://www.gofundme.com/Behrend-College-Republican-Formal,"Erie, PA",My name is Avery Skiviat and I am part of the political science community at Penn State Behrend. Our organization wants to attend a trip to Florida from December 19-22nd. We are attending the Student Action Summit hosted by Turning Point USA. This event will have over 4000 college students intere...,Behrend College Republican Formal,rep,20,1000                    ," December 3, 2018",1000.0,20.0
37,https://www.gofundme.com/beach-cities-republicans,"Palos Verdes Peninsula, CA","We meet every Third Thursday at the Torrance Sizzler in Torrance on Sepulveda Blvd. Last month, we were noticed of new policy changes on reserving the room. We are now force to pay a non-refundae room deposit to book the Sizzler meeting room.   We have to have a min of 50 memberships a year to  b...",Beach Cities Republicans,rep,100,1800                    ," August 30, 2018",1800.0,100.0
38,https://www.gofundme.com/sst-to-the-dominican-republican,"Fort Wayne, IN","I’m raising money to be able to have a fun lifetime experience and opportunity to travel to the Dominican Republic ! In order to go, I have to pay for three specific shots, a passport, other things to travel. I'm asking for donation, prayers, and what ever else you may be able to offer.  I will b...",SST Trip To The Dominican Republican,rep,80,500                    ," March 13, 2019",500.0,80.0
39,https://www.gofundme.com/exploration-into-district-1-republican-congress,"Franklinton, NC","I would like to set this up to cover my exploration into running for Congress in district 1 in NC. I am a Republican and want to bring common sense back into Congress. It's an uphill battle, but I look forward to the challenge. I appreciate you even taking the time to read this, I know it's a lon...",Exploration into District 1 Republican Congress,rep,160,7500                    ," February 22, 2019",7500.0,160.0
40,https://www.gofundme.com/electing-republican-women-training,"Honolulu, HI","To ensure the full spectrum of Republican Women voices who want to lead and run for office: This train for Republican women will cover topics, including making the decision to run, finding your voice, and effective networking. Only those at the table can truly make change...Help us get to the tab...",Electing Republican Women Training,rep,150,1600                    ," February 21, 2019",1600.0,150.0
42,https://www.gofundme.com/7rv3k-help-me-go-to-washington-dc,"Coral Springs, Florida","I am the founder of a club at my school called Black Republican Leaders. Don’t let the name confuse you, everyone is allowed to attend the club but we chose the name because we’re a group of young black republicans trying to normalize our political views. Our group was created about a month ago a...",Republican Leaders Washington DC trip.,rep,50,1000                    ," June 15, 2019",1000.0,50.0
43,https://www.gofundme.com/patrick-henry-teen-republicans,"Roanoke, VA","Roanoke City Public Schools currently have 250 students identified as homeless. The teachers and students of Roanoke City Public Schools will come together on November 17, 2018 and compete in a city-wide dodgeball tournament. All of the proceeds will benefit the Help the Homeless Fund. Our Help t...",Patrick Henry: Teen republicans,rep,25,500                    ," November 1, 2018",500.0,25.0
44,https://www.gofundme.com/oregon-republicans-threatened-w-arrest,"Hillsboro, OR",Oregon Governor Kate Brown has ordered the state police to round up legislators.  Their by forcing a quorum at gunpoint  in an attempt to force a vote on an emergency cap and trade bill.   Legislators will be fined $500 per day while they are in hiding.   All donations will will be given to https...,Oregon Republicans threatened w/ arrest.,rep,20,500                    ," June 20, 2019",500.0,20.0
45,https://www.gofundme.com/dominican-republican-mission-trip,"Bay City, MI","My goal is to visit the Dominic Republic this summer to build housing and community space, work with families and improve lives.  I'll be using the funds to secure a flight, lodging and meals.   With your donation, I can make a difference in the lives of many people.  I'll be sharing photos and e...",Dominican Republican Mission Trip,rep,10,700                    ," March 14, 2019",700.0,10.0
46,https://www.gofundme.com/antirepublican-apparel,"Brooklyn, NY","I say we fight propaganda with propaganda and create an anti-republican clothing line. Think classy anti-trump  and Notorious RBG shirts, similar to those with the image of Biggie Smalls. The shirts out now that follow our mantra are not great quality, and are lacking  in style . The next time th...",anti-republican apparel,rep,5,350000                    ," December 24, 2018",350000.0,5.0
47,https://www.gofundme.com/citadel-republican-society-to-cpac,"Charleston, SC","The Citadel Republican Society is looking to raise money for our annual trip to the Conservative Political Action Conference in Washington, D.C. This trip allows us to represent The Citadel, Charleston, and the state of South Carolina as one of the single largest school delegations that attends e...",Citadel Republican Society to CPAC,rep,0,75000                    ," September 4, 2018",75000.0,0.0
50,https://www.gofundme.com/republican-challenger-to-president-trump,"Dover, NH","The Republican Party has not presented a nominee to challenge President Trump in the Republican Primaries. Until that happens, I am raising funds to start a presidential campaign. Am I qualified to be president? Not currently. Am I more qualified than President Trump to be president. Maybe, maybe...",Matthew Argall: A Presidential Bid,rep,0,250000                    ," April 8, 2019",250000.0,0.0
51,https://www.gofundme.com/help-move-2-republican-families-from-oregon,"Lebanon, OR",11 people of a Republican party want to leave the state of oregon. They all are for the wall and all are Republican people and are looking into relocating these families because of how different they are compared to their community's. Many people have told them to leave. Help fund them all on the...,Get 11 Republican people out of oregon,rep,0,29000                    ," February 16, 2019",29000.0,0.0
52,https://www.gofundme.com/help-umass-boston-college-republicans-attend-cpac,"Boston, MA",The College Republicans at the University of Massachusetts Boston (UMBCR ) have been working hard to bring a conservative voice to the UMB campus for over a year now. As we endeavor to continue our mission we are asking for your support. February 27th marks the beginning of the 2019 Conservative...,Help UMass Boston College Republicans attend CPAC!,rep,0,5000                    ," January 17, 2019",5000.0,0.0
53,https://www.gofundme.com/democrat-parents-disowns-republican,"Hillside, NJ",So basically i told my parents i am a republican and i support Donald Trump and this basically stopped paying my tuition and i have no were to stay im very hardworking and really want to finish college please help me out #MAGA  check my twitter for more information @Lovely_Flow201,Democrat Parents Disowns Republican,rep,0,20000                    ," November 6, 2018",20000.0,0.0
55,https://www.gofundme.com/inform-swing-state-republicans-about-border-crisis,"Harleysville, PA","Our Republican friends, neighbors, colleagues and family members aren't monsters who are glad that families are being separated at the border, and the inhumane treatment of detainees, especially children, in detention centers for immigrants. Instead, they deeply value their own families, and want...",Inform Swing State Republicans About Border Crisis,rep,0,999                    ," July 9, 2019",999.0,0.0
56,https://www.gofundme.com/young-black-republican-needs-money-for-college,"Trenton, NJ","Hello everybody! Recently, I decided to come out to my family and friends in support of President Donald Trump. The reactions I’ve received initially started as them ignoring me or chastising me for my beliefs, but now they’ve gone as far as to cut off funding for me this upcoming school year. I’...",Young Black Republican Needs Money For College!!!!,rep,0,10000                    ," July 6, 2019",10000.0,0.0
57,https://www.gofundme.com/1oqjn6to80,"Long Beach, CA","PRESIDENTIAL CANDIDATE'S CAMPAIGN PLATFORM): !!! : --->  To rekindle ""American Dream"", ---> To make American Citizens First Class Citizens in their own Land; ---> To deport (all) Domestic Terrorists, and Hardened Criminals from USA, ---> To restore Family Values, To call for Referandum !!!, whe...","""Black Ted Cruz"" Republican Presidential Candidate",rep,0,1.8M                    ," July 3, 2019",1800000.0,0.0
58,https://www.gofundme.com/make-me-vote-republican,"El Cajon, CA","For the next presidential election, I will vote REPUBLICAN. I’m so sick of both parties!!!",Make Me Vote Republican!!!,rep,0,2000                    ," June 30, 2019",2000.0,0.0
59,https://www.gofundme.com/young-republicans-rally-nyc-union-square,"New York, NY",I want to bring a real Youth Trump Rally to the liberal heart of NYC - Union Square.     Lets show that our voices will be heard in all of America!  Your donations will help Make America Great Again!!!,Young Republicans Rally NYC. Union Square,rep,0,1000                    ," June 30, 2019",1000.0,0.0
60,https://www.gofundme.com/republican-presidential-candidate,"Temecula, CA",To run as a Candidate for the President of the United States.  Beliefs are: - Smaller Govt. - Better Tax Program - Stronger USA - Less Off-Shoring of US Jobs     - This doesn't mean that we cannot help the undeveloped and      oppressed countries to improve their own regional economic prosperity...,USA Presidential Candidate,rep,0,5000                    ," June 28, 2019",5000.0,0.0
61,https://www.gofundme.com/1oi4td52o0,"Dallas, TX","My goal is to train our youth in the art of gun safety in case of burglary, national/civil conflict, or all-around general knowledge. I have found it necessary for the youth to learn gun safety and how to use firearms and semi-auto/automatic weapons. I want to be part of a more conservative Ameri...",Gun Training For Young Republicans,rep,0,10000                    ," June 27, 2019",10000.0,0.0
62,https://www.gofundme.com/5r3dut-abortion-needed,"Birmingham, AL","Hi, raising money To continue my education. I’m a college student putting myself through school. I’m currently an economics major and I am raising money to start up a young Republicans club at my school. We strongly need a place where people with the same values and ideas can come together. In th...",Young Republicans,rep,0,1200                    ," June 26, 2019",1200.0,0.0
