Unnamed: 0,link,location,summary,title,tag,raised,goal,created_date,goal_int,raised_int
391,https://www.gofundme.com/RNCMedics,"Stevensville, MT",We have closed this campaign. If you are interested in supporting Street Medics continuing efforts we are organizing for a DNC response next week. To donate go to gofundme.com/dncmedics THANK YOU FOR ALL YOU SUPPORT!  RNC Response by the Rust Belt Street Medic Collective This month’s Republican N...,Rustbelt Street Medics RNC Response,rep,2207,5000                    ," June 25, 2016",5000.0,2207.0
392,https://www.gofundme.com/VP2020,"Williston, FL","￼ ￼On Election Night 2018, we all watched in horror as Republicans stole statewide elections in Georgia and Florida.  Republican Georgia Secretary of State Brian Kemp  used his official powers to suppress hundreds of thousands of African-American votes on his way to ""defeating"" Democrat Stacey Ab...",Voter Protection 2020: MAKE EVERY VOTE COUNT,rep,2595,2500                    ," January 17, 2019",2500.0,2595.0
393,https://www.gofundme.com/help-floridian-felon-erica-racz-regain-her-vote,"Mc Farland, WI","As told by the Washington Post : In November, an overwhelming majority of Florida voters passed a ballot measure automatically restoring voting rights to former offenders. Amendment 4 gave nearly 1.5 million people our voices back. After that change to the state constitution, the rate of new regi...",Help Floridian ExFelon Erica Racz Regain Her Vote!,rep,415,880                    ," June 30, 2019",880.0,415.0
394,https://www.gofundme.com/support-truthdig039s-coverage-at-the-usmex-border,"Santa Monica, CA",summary was NoneType,Support Truthdig's Coverage at the U.S.-Mex Border,rep,3153,9500                    ," December 8, 2018",9500.0,3153.0
395,https://www.gofundme.com/4-dimensions-one-body-music-video,"New York, NY",Representation is a very powerful tool and we are on a mission.  It's not everyday that we get to turn on the radio and hear Hip-Hop/ Rap music created and inspired by people like us. For far too long we've been forced to cater our viewing/listening habits around our heterosexual counterparts and...,4 Dimensions [Music Video],rep,1603,10000                    ," February 20, 2019",10000.0,1603.0
396,https://www.gofundme.com/ip2xb4,"Austin, TX",America is the only country in the world that sentences children to die in prison with no possibility of parole.  For the last year I have tried to get others to help Oklahoma join other states (even republican states) that have ended JLWOP. I finally understand exactly what it takes... $,Freedom comes with a price?,rep,1915,20000                    ," December 11, 2014",20000.0,1915.0
397,https://www.gofundme.com/lindaandlarrytogether,"Washington, DC","The video is a MUST watch.  It is the story of what true love is! A good family that has worked their entire lives should not be subjected to horrors such as this, especially when they need each other the most.  If you work and pay your fair share, this should not happen in this country.  Linda a...",Linda & Larry Drain (Love Reunited),rep,1575,5000                    ," February 15, 2018",5000.0,1575.0
398,https://www.gofundme.com/253er3zw,"Seattle, WA","My name is Chad Lupkes, and I’m asking for your support to finance my trip to Philadelphia as a CD Delegate from the 7th Congressional District of Washington, as well as your help over the next few years. This Political Revolution goes beyond 2016, and we’ve always known that.  I was born in Seat...",Chad to Philadelphia for Bernie,rep,2768,5000                    ," May 22, 2016",5000.0,2768.0
399,https://www.gofundme.com/lawson2016,"Tampa, FL","Hello, My name is Willie Lawson. I am running for County Commission in Hillsborough County Florida.  I am a Frederick Douglass Republican trying to make a difference!  I abide by the four life affirming values of Douglass which are:  1. Respect for the Constitution 2. Respect for Life 3.Limited G...",Lawson For Commission Campaign,rep,2649,6000                    ," May 17, 2015",6000.0,2649.0
400,https://www.gofundme.com/eikekrebs,"Saint Joseph, MI","Eike Krebs was lost in Lake Michigan on November 19, 2015. Eike was a son, brother, grandson, cousin, nephew and friend to many. Eike raised chickens, ducks, geese and Heritage Turkeys and was very involved in the Berrien County Youth Fair. He LOVED politics and all things conservative. He was in...",Eike Krebs Memorial Fund,rep,4460,5000                    ," December 1, 2015",5000.0,4460.0
401,https://www.gofundme.com/SaveOurAngel,"Seattle, WA",Angel's Shoe Repair is a fixture in the Capitol Hill region of Seattle. Owned by the Angel family for 3 generations the buisness is over 100 years old with over 70 years on the block at the corner of 15th and E. Republican in the vibrant 15th Avenue area of the Capitol Hill neighborhood.  Ray Ang...,Save Our Angel! Angel's Shoe Repair,rep,5852,20000                    ," May 30, 2015",20000.0,5852.0
402,https://www.gofundme.com/ncgop,"Raleigh, NC","A North Carolina Republican Party office in Orange County was firebombed overnight, causing major damage and destruction. Thankfully, there was no loss of life. The explosive device was thrown through the window of the office, and the words, “Nazi Republicans, leave town or else,” were painted on...",Orange County NCGOP Arson Repair,rep,4125,10000                    ," October 16, 2016",10000.0,4125.0
403,https://www.gofundme.com/loveonGelgots,"Lititz, PA","Joe Gelgot was raised in Mountaintop/Hazelton, Pa. by Joe and Joanne along with his brother Steve in an amazing community steeped in traditions and a love for their polish heritage. He and Cindy shared this love for their heritage deeply and have cultivated this in their kids as well. There are s...",Love offering for the Gelgot family,rep,2400,5000                    ," March 28, 2017",5000.0,2400.0
404,https://www.gofundme.com/tribute-to-men,"Redondo Beach, CA","Tribute to Men Rally  DeAnna Lorraine (@DeannaLorraine7) is an author and pro-male media personality, TV show host and I along with several other big names are organizing an amazing rally in Washington DC on the last week of February. We're calling it ""A Tribute to Men Rally,"" and we will be havi...",Tribute to Men,rep,1710,10000                    ," January 28, 2019",10000.0,1710.0
405,https://www.gofundme.com/EdHall2016DNC,"Denver, CO","Fellow Lefties / Friends, I am excited to announce that I was elected to the National Credentials Committee of the Democratic National Convention - one of three Colorado members on the committee!   I intend to ensure that all credentials issues are resolved in a transparent manner and that our de...",Support Ed Hall to the 2016 DNC,rep,2043,2000                    ," April 27, 2016",2000.0,2043.0
406,https://www.gofundme.com/4rsrs-help-patriot-vera-anderson,"Phoenix, AZ","HELP VERA ANDERSON KEEP FIGHTING TO SAVE AMERICA One of the most committed grassroots patriots in Arizona is in trouble. We are four friends who want to help Vera Anderson, founder of one of Arizona’s first tea parties. Our four statements are below.  FROM MARIANNE FERRARI: Vera was there when th...",HELP PATRIOT VERA  ANDERSON,rep,5603,20000                    ," September 24, 2018",20000.0,5603.0
407,https://www.gofundme.com/s5fs8-feeding-the-community,"Fort Pierce, FL",I want to help feed people in support of the company( In and Out Burgers )who are being boycotted by liberals for donating to the republican party. We do not have their fast food chain in my area so I want to send my family in the areas they are located to perform random acts of kindness by purch...,Feeding the community,rep,155,200                    ," August 31, 2018",200.0,155.0
408,https://www.gofundme.com/recipe-for-a-sellout-fundraising-campaign,"Brooklyn, NY","WHO ARE WE?  ""Recipe for a Sellout"" is a new, original musical with book and lyrics by Parade Stone and music by Sequoia Sellinger. The production team has begun to embark on a daunting task; funding a musical from the ground up.   The ""Recipe for a Sellout"" team is fundraising for the musical's...",Recipe for a Sellout Fundraising Campaign,rep,1493,2000                    ," January 2, 2019",2000.0,1493.0
410,https://www.gofundme.com/women039s-campaign-school,"Lake Bluff, IL","Hi Everyone, I was honored to be accepted into the Women's Campaign School at Yale's Class of 2019. This program only accepts 80 women a year from across the country, and I am so excited to be one of them. This prestigious program is designed to educate women leaders in the political field. I wil...",Women's Campaign School,rep,985,4000                    ," May 16, 2019",4000.0,985.0
411,https://www.gofundme.com/samuel-williams-for-congress,"El Paso, TX",As a nation we must support our natural born citizens first they are the heart and soul of America. I support legal immigration tied to the country’s economic needs and ability to assimilate newcomers. I support strong borders. I also believe in America’s unstinting moral obligation to help genui...,Don't Let Texas Turn Blue,rep,520,100000                    ," April 29, 2018",100000.0,520.0
413,https://www.gofundme.com/letsstand,"San Antonio, TX","There are three women on this journey!  First off, I'm Caden A political activist, wife, and mother. I was a Bernie Sanders National delegate, and continuing the revolution here in Texas by working on progressive candidates campaigns. I am the Volunteer Coordinator for the Tom Wakely campaign aga...",Help Us Stand With Standing Rock!,rep,2266,4000                    ," October 28, 2016",4000.0,2266.0
414,https://www.gofundme.com/stop-tax-increase,"Ringgold, GA","Funds raised will be used to defeat the Sales Tax Increase from 7% to 8% in Catoosa County, Georgia (aka T-SPLOST).  It will be used for signs, news paper ads and mail to likely voters.  The campaign is organized by Responsible Governance Committee, Denise Burns, Chairperson, a Committee of the N...",Stop Catoosa Tax Increase,rep,1190,4000                    ," January 22, 2019",4000.0,1190.0
415,https://www.gofundme.com/JackBelltoRNC,"Olympia, WA",My name is Jack Bell and I am an 18 year old Senior at Olympia High School.  I began my political journey in Olympia during the Republican caucus in March.  I was elected to be a county delegate and attended the State Republican Convention in Pasco.  Yesterday I was humbled and honored to be elec...,Jack Bell RNC Delegate to Cleveland,rep,3790,5000                    ," May 22, 2016",5000.0,3790.0
416,https://www.gofundme.com/fergusongriffin-legal-defense-fund,"Lynchburg, VA","For nearly 18 months, John Ferguson and Travis Griffin have had to defend themselves against a baseless $875 lawsuit brought against them by the Campbell County Republican Party, with Rick Boyer as the Republican Party’s lawyer. Our attorneys got most of the counts dismissed at the demurrer stage...",Ferguson-Griffin Legal Defense Fund,rep,2120,12000                    ," November 13, 2016",12000.0,2120.0
417,https://www.gofundme.com/doctors-at-the-border,"Frisco, TX","There are several thousand refugees, legally seeking asylum in the United States, whom have been detained in U.S. detention centers in conditions that have left them ill and traumatized upon release, with no medical attention or even basic wellness/self-care supplies such as toothbrushes. The suf...",Doctors at the Border,rep,2105,15000                    ," November 8, 2018",15000.0,2105.0
418,https://www.gofundme.com/2pb9mxms,"Los Angeles, CA",Help Dale and Takashi cover their hospital and travel expenses.  Takashi has to travel from Japan every few weeks until Dale can go home.  It could take several trips.  He will miss out on his paycheck and will have other expenses.     Read their story as it was told in The Pride LA and also lgbt...,Together Until The End,rep,1665,35000                    ," September 15, 2016",35000.0,1665.0
419,https://www.gofundme.com/please-help-volunteercontribute-more-efficiently,"Toledo, OH","Hello. I am humbled to ask of your help in financial support to go back to school taking Photography Classes and to be more efficient in my volunteer work, maintaining my role as the unofficial photographer to most every Toledo Republican Club and funding a better future career in photography wit...",Please help Andy contribute more efficiently 2019,rep,770,2500                    ," December 13, 2018",2500.0,770.0
420,https://www.gofundme.com/zp6g8w,"Papaaloa, HI","For it is in giving that we receive. − Francis of Assisi  If you know Franzi, you can close your eyes and immediately see her smile.  It lights up her face, shines through her eyes, and penetrates whatever mood you are in.  With her contagious passion for life, she doesn’t allow you to exist in a...",Fighting for Cooper!,rep,7870,100000                    ," July 19, 2015",100000.0,7870.0
421,https://www.gofundme.com/dennistocleveland,"Raleigh, NC","July 17 - 21, 2016 Thousands of Republicans from around the United States will descend on Cleveland for what promises to be an historic convention!  I've been honored by the North Carolina Republican Party to attend as an Alternate Delegate. As you can imagine, this is a costly venture. Hotel roo...",Help Send Dennis to Cleveland!,rep,1640,2000                    ," May 20, 2016",2000.0,1640.0
422,https://www.gofundme.com/FloridaBlackPower,"Saint Petersburg, FL","Poor and working class Black people in Florida are struggling to get to the Black People's Convention in DC. These are people who work tirelessly but still struggle to feed their families. I believe these are the people that must get to this Convention! The black people who live in the ""ghetto"" a...",Help Florida Vote 4 Black Power!,rep,2267,3400                    ," October 20, 2016",3400.0,2267.0
424,https://www.gofundme.com/2016Conventions,"Brush Valley, PA","IUP Professors Michele Papakie (Journalism and PR) and David Chambers (Political Science) plan to take 40 students to the 2016 Republican and Democratic National Conventions this July! Earlier this month, we took 29 students on a day-long bus trip to the Pennsylvania Capitol  in Harrisburg to par...",IUP Experiences Democracy in Action,rep,5050,37755                    ," February 16, 2016",37755.0,5050.0
425,https://www.gofundme.com/2a77x3p2,"Redmond, OR","Hello to everyone and thank you for your donations.   I have been a YUGE Bernie supporter in this political cycle, spending countless hours canvassing, phone banking, training volunteers, holding informational dinners, organizing rallies, and everything else that I could possible do to register h...",Bernie Delegate Matthew Rock ! ! !,rep,1790,2750                    ," June 19, 2016",2750.0,1790.0
426,https://www.gofundme.com/mullen-lisle-township-supervisor,"Lisle, IL","Thank you all for your help in my campaign.  Without each of you, I never could  have been successful!  I am Mary Jo Mullen, resident and small business owner in Lisle, Illinois.  Following the November election, the resounding message from both sides was that there were no good choices on the ba...",Committee to Elect Mary Jo Mullen,rep,2195,2500                    ," December 28, 2016",2500.0,2195.0
427,https://www.gofundme.com/vwukc,"Lakewood, WA","When I was honorably discharged  from the Army, I knew I wanted to continue serving my country. I began fighting for other veterans - to ensure the thanks of a grateful nation didn't pass them by. Then I continued fighting for my fellow citizens - to make this country one we could be proud of. ...",Get This Veteran  To The RNC,rep,2590,2900                    ," May 11, 2016",2900.0,2590.0
428,https://www.gofundme.com/support-oregon-gop-state-senators,"Bend, OR","Throughout this legislative session, fascist Democrats in the Oregon legislature have attempted to pass bills that violate both the Oregon and United States constitutions. Rather than let the people of Oregon vote on the issues, they are attempting to use their supermajority to force their Marxis...",Support Oregon GOP State Senators,rep,950,36000                    ," June 20, 2019",36000.0,950.0
429,https://www.gofundme.com/rnc2016,"Mesquite, TX","Dear Friends, I have been elected a Delegate to the Republican National Convention in Cleveland, July 18-21. This distinguished  honor comes after 30+ years of campaign activity.  Please note,  I was elected, not appointed, a delegate.   I had a competitive race with 6 opponents.  I pledge to  at...",Get this RNC Delegate to Cleveland,rep,1775,3800                    ," May 17, 2016",3800.0,1775.0
431,https://www.gofundme.com/losing-site-amp-use-of-my-arms-amp-legs,"Commerce, TX","Though not everyone will have the time to read this story but if everyone could please share this story with others so those who are experiencing similar problems can read it, and find their not alone out there.  I am a single disabled father 56 years of age having never really been on such a lim...",ENDLESS PAIN TO MY ARMS LEGS & EYES,rep,160,10000                    ," July 28, 2018",10000.0,160.0
432,https://www.gofundme.com/adamforbernie,"Orlando, FL","Hello, Internet! My name is Adam Woodhall. I am a resident of Orlando, Florida, originally from Cincinnati, Ohio (Go Bengals!), and an elected at-large delegate, by the Florida Democratic Party, for Bernie Sanders.  This is the first time I have been involved in a political campaign. So far in my...",Send Delegate Adam to Philly!,rep,1863,3000                    ," June 20, 2016",3000.0,1863.0
433,https://www.gofundme.com/CoronadoRNC,"Aubrey, TX","On Saturday, May 14th I was elected At Large Delegate Alternate in the 26th Congressional District of Texas.  As a result, I've been invited to the 2016  Republican National Convention this July 17-22, and I'm ecstatic! I will have full access to the daily events and a seat as an alternate vote o...",Coronado to RNC National Convention,rep,2260,4000                    ," May 22, 2016",4000.0,2260.0
434,https://www.gofundme.com/Micheal4Bernie2016,"Denver, CO","Hello, my name is Micheal Baca. I was recently elected as an Alternate to the Democratic National Convention in Philadelphia, Pennslyvania to represent the People of Colorado. I am raising money to cover the expenses of the trip, i.e. flight and lodging fees.  The convention is July 25-July 28 an...",Taking the Revolution to Philly.,rep,1800,1800                    ," April 20, 2016",1800.0,1800.0
435,https://www.gofundme.com/harvard-kennedy-school-expenses,"Cornelius, NC","In 2010, I became severely  ill, resulting in countless hospitalizations and surgeries over several years. As a result, I had to leave Israel, stop litigating in NYC, and ultimately move to Charlotte, NC with my family. This left me isolated from my friends and a Jewish community and unable to ac...",Harvard Kennedy School Expenses,rep,1749,20000                    ," March 20, 2018",20000.0,1749.0
436,https://www.gofundme.com/the-results-international-conference,"Topeka, KS",I have already been accepted for a fellowship with RESULTS to help end poverty! Funding me will allow me to attend the International Conference on July 13 in Washington D.C.! At this conference I will be working with people in Congress (both sides of Republican and Democratic) in ways we can end...,The RESULTS International Conference,rep,200,200                    ," May 22, 2019",200.0,200.0
437,https://www.gofundme.com/5rcrrls,"Naples, FL","Please help support Murat’s legal fees, medical treatment, and expenses for his wife who had to travel to Kazakhstan with her three children to try and fight for Murat’s freedom. Murat was taken into custody right after an eye surgery which requires additional medical care or he is at risk of los...",Free Murat Tungishbayev!,rep,1175,10000                    ," July 3, 2018",10000.0,1175.0
438,https://www.gofundme.com/smith-college-trip-to-belfast-and-dublin,"Northampton, MA","Hi everyone!  I was recently accepted for a twelve day trip through Smith College to Belfast and Dublin Ireland for this coming May. Smith has been very helpful in aiding me with finances, but I am still a little short on funds.  The money raised from this campaign will go towards the price of th...",Smith College Trip to Belfast and Dublin,rep,135,1200                    ," February 28, 2019",1200.0,135.0
440,https://www.gofundme.com/defeat-cm-roy-moore,"Pacific Palisades, CA","I am taking out a half page AD in the Front section Of the Birmingham ALABAMA newspaper on Sunday DEC. 10, saying:  “I believe the women, yes, he should step aside”  Republican Senate Majority Leader Mitch McConnell about candidate Roy Moore.   Vote for Doug Jones on Tuesday the ad is costing me...",DEFEAT CM ROY MOORE,rep,2405,3000                    ," December 5, 2017",3000.0,2405.0
441,https://www.gofundme.com/bkzy6m-american-party,"Charleston, SC","This is a fundraiser to start a new political party or movement.  If you are tired of watching corrupt politicians and corporations enrich themselves then let’s start the revolution now.  My vision is to create a political platform void of corporate sponsorship or special interest groups, PACs, e...","Let's start a new political party,  American Party",rep,100,10.0M                    ," February 9, 2019",10000000.0,100.0
442,https://www.gofundme.com/verchinski,"Albuquerque, NM",I have been selected for New Mexico to be the State At Large Delegate to the National Convention.  It was a very close race with a great challenger from Las Cruces.  I have been watchining my country slide for a long time.  Friends struggle to make ends meet as retirees or persons on disability....,Verchinski NM BernieDelegateFunding,rep,1721,2286                    ," June 22, 2016",2286.0,1721.0
443,https://www.gofundme.com/fkyw2-jesus,"Toledo, OH","I am a devout Catholic who loves to pray The Rosary and help people. I take care of my best friend, 24/7, because he has alzheimer's and other health issues. He is on a very limited income. Now, our car doesn't start. So, it would sure be nice to get a little help in getting it repaired quickly s...",Kristi's Campaign,rep,3029,2500                    ," March 3, 2018",2500.0,3029.0
444,https://www.gofundme.com/wende,"Florence, OR","On Monday, December 1, Wende ""Red"" Jarman suffered a major attack of diabetic ketoacidosis brought on by a systemic infection. She was taken by ambulance to Peace Health hospital, where she is resting, recovering, and slowly regaining her irreverent sense of humor.   Luckily, Wende had been accep...",Wende's Recovery Fund,rep,4720,5000                    ," December 4, 2014",5000.0,4720.0
445,https://www.gofundme.com/FTDHarrington,"Portland, OR","I am seeking travel funds for the Cleveland Convention with Free the Delegates. I bring many capabilities to the table and I have done much for the cause already.  1) I am the man who did the math showing 12 million Democrats crossed over in the election.  2) I did not start this early, instead I...",Michael Harrington Convention Whip,rep,1985,1700                    ," July 9, 2016",1700.0,1985.0
446,https://www.gofundme.com/6n8p114,"Sioux Falls, SD","It’s that time of year again!! The time of year where young conservatives gather from around the country to attend the Conservative Political Action Conference (CPAC) and learn about how to be young activist in a predominately liberal environment. Once again, I was offered to attend CPAC due to m...",CPAC,rep,550,500                    ," January 6, 2019",500.0,550.0
447,https://www.gofundme.com/gop-state-committee,"Hoboken, NJ",I am running for NJ GOP State Committee from Hudson County.  The NJ GOP suffers not only from a significant gap in registration with the Democrats but also (and related to) its inability or unwillingness to outreach and engage with communities that do not traditionally vote Republican. We cannot...,GOP State Committee,rep,5991,30000                    ," January 14, 2017",30000.0,5991.0
448,https://www.gofundme.com/cwuz9b2g,"Lincoln, NE","About us: We come from all walks of life in Nebraska: Democrats, Republicans, and independents; teachers, lawyers, scientists, professors, information technologists, retirees, students, faith leaders, stay-at-home parents. We are Nebraskans concerned about gun violence in our state and country. W...",Nebraskans Against Gun Violence,rep,1634,1000                    ," August 15, 2015",1000.0,1634.0
449,https://www.gofundme.com/86onv0,"Philadelphia, PA","Given the current political turmoil in Ukraine, now is an important time to support democracy in the country. I have volunteered to serve as an International Election Observer for Ukraine's upcoming Presidential and Municipal Elections on May 25th, 2014, and I ask for your support. Financial supp...",Support fair elections in Ukraine,rep,2815,2500                    ," April 8, 2014",2500.0,2815.0
450,https://www.gofundme.com/laugh-in-your-face-radio,"Spring Valley, CA","“Laugh In Your Face” is a progressive radio show that airs four times a week on KNSJ 89.1FM in San Diego (streamed over the Internet at knsj.org). Unlike corporate-owned radio stations that censors what topics radio hosts can cover, KNSJ is completely supported by listener donations. In addition,...",Laugh In Your Face Radio,rep,735,1000                    ," November 13, 2017",1000.0,735.0
452,https://www.gofundme.com/support-third-party-ballot-access,"San Francisco, CA","Nathalie Hrizi — Peace and Freedom Party candidate for Insurance Commissioner  Nathalie Hrizi is a public school teacher in San Francisco, a union and social justice activist, and editor of the quarterly magazine Breaking the Chains: A Socialist Perspective on Women’s Liberation.Her campaign is c...",Support Third Party Ballot Access!,rep,1622,1500                    ," January 3, 2018",1500.0,1622.0
