Unnamed: 0,link,location,summary,title,tag,raised,goal,created_date,goal_int,raised_int
836,https://www.gofundme.com/trump039s-tweets-against-ted-cruz,"Austin, TX","Republican strategists think Trump's endorsement of Ted Cruz is the best path toward getting Cruz re-elected, which in turn, insulates Trump from any check on the executive branch. Trump and Cruz have called each other ""liar"" and ""sniveling coward,"" so we'd like to poke fun at the situation and m...",Cruz vs. Trump for O'Rourke,rep,0,6000                    ," September 16, 2018",6000.0,0.0
837,https://www.gofundme.com/zmxmv-build-the-damn-wall,"Anderson, SC","If the 63,000,000 that voted for DJT gave 50.00 each...that would be OVER 3 BILLION DOLLARS we could put toward the wall!!!  I AM TIRED OF THE STALLING!!!   I AM TIRED OF THE INNOCENT FAMILY'S LOSSES!!! I AM TIRED OF THE MONIES BEING  WASTED!!! I AM TIRED OF THE SENATE THINKING AMERICA IS STUPID!...",BUILD THE DAMN WALL!!!!,rep,0,10.0M                    ," September 11, 2018",10000000.0,0.0
838,https://www.gofundme.com/the-voters-party,"Chicago, IL",We are an emerging grassroots political party founded in 2018 by a group of American citizens—from both conservative and liberal backgrounds—who are concerned that our democracy has become totally captured by special interests and lobbyists. This is made possible by the existence of professional...,Help Found the Voters Party,rep,0,25000                    ," September 5, 2018",25000.0,0.0
839,https://www.gofundme.com/e3gkpv-disabled-veteran-vehicle-fund,"Camarillo, CA","I am a service-connected disabled veteran that, even though I cannot stay on my feet very long due to knee injuries, I only receive a 10% rating from the VA. I am in the process of filing a new claim. I used to be a member of the Republican Presidential Task Force from 1984 to1989 during the Reag...",Disabled veteran vehicle fund,rep,0,8250                    ," August 25, 2018",8250.0,0.0
840,https://www.gofundme.com/let039s-build-mcl,"California City, CA","Hello My Friends,  It brings me much joy, happiness and the ecstasy of full exuberance to bring you such great news today of what transpires and how it is developing in our world today for many wonders which will soon fill our world shall and will abound!  There is among (many other developments...",Let's Build MCL,rep,0,7000                    ," August 13, 2018",7000.0,0.0
841,https://www.gofundme.com/Alice-Koller-Still-writing,"Denver, CO","I'd like to introduce you to a dear friend of mine, Dr. Alice Koller, who earned her Ph.D. in philosophy from Harvard. You may be familiar with her first book, which Holt, Rinehart, and Winston published in 1982 under the title, An Unknown Woman.  The book had been read aloud in its entirety on N...",Alice Koller: Still writing at 93,rep,0,10000                    ," September 8, 2018",10000.0,0.0
842,https://www.gofundme.com/liz-goes-to-leipzig,"Athens, OH","Namaste,  At this present moment, I am welcoming in an exciting chapter of my life, as I will be moving to Leipzig, Germany this September to complete my dual master's degree program, earning an MS in Journalism and MA in Global Mass Communications next May from Ohio University and the University...",Liz goes to Leipzig for MA/MS,rep,0,500                    ," May 1, 2018",500.0,0.0
844,https://www.gofundme.com/2czrpuv8,"Washington, DC",My name is Connor Hatch. I am not a certified blue check on Facebook as a public figure however I am an American citizen who thinks White House officials should be held to the same standards as employees in the workplace.  Please read the entire statement before emailing questions.  DO NOT MAKE D...,White House Sexual Harassment Seminar,rep,0,100000                    ," December 20, 2018",100000.0,0.0
845,https://www.gofundme.com/hwd3m278,"Tampa, FL","Trump Loves America... Lets return the favor People. I myself lobbied for President Trump in his 2016 campaign run. We were able to raise $100,000 for his initial term. We must insure he has more time to finish what he has started in this beautiful country ""WE"" call home. We should all feel the d...",Trump Re-election Campaign,rep,0,1.0M                    ," December 21, 2018",1000000.0,0.0
846,https://www.gofundme.com/over-the-border-under-the-bridge,"Glenshaw, PA","Our countries current situation, involving the southern border deserves more attention.  The issues of child separation, the building of a border wall and human rights have affected the political mind set and moral conscience of our country.  We believe that by capturing and    documenting the ev...","Over the Border, Under the Bridge",rep,0,3500                    ," July 10, 2019",3500.0,0.0
847,https://www.gofundme.com/a-manual-for-freedom,"Cottonwood, AZ","We dedicate this campaign to the lovers of America, the believers, the patriots, the rebels those living by principle, faithful to our founding vision and willing to do whatever is required to redeem and preserve the vision of liberty for our children. The intention of this campaign is to create...",A Manual For Freedom,rep,0,10000                    ," July 9, 2019",10000.0,0.0
849,https://www.gofundme.com/protect-my-dead-grandma039s-voting-rights,"Toledo, OH",My grandma has always been a republican. That changed when trump was elected president. His appalling behavior left her speechless.  Now my dead grandma has registered as democrat but cannot vote in general election due to her condition. We need money for lawyers so she can sue for her right to v...,Protect my dead grandma's voting rights,rep,0,1000                    ," July 7, 2019",1000.0,0.0
850,https://www.gofundme.com/bindner-for-president-2020-gop,"Rockville, MD",My name is Michael Bindner and I am raising money to launch a campaign to challenge Donald Trump for the Republican Nomination for President. It is time to bring back the Republican big tent. Trump has alienated thinking Republicans from the party. My campaign will bring them back. The Obama and...,Bindner for President 2020 GOP,rep,0,50000                    ," July 6, 2019",50000.0,0.0
851,https://www.gofundme.com/Trumpinoffice, ,"Four more years!”I’m a Trump supporter. I voted for Trump. And now I noThey Cant get over on the other side of that fence.”the Trump reelection campaign, and the Republican National Committee need us more than ever. instead of sitting back and taking it We’re starting to speak up. It’s an expecta...",Four More Years !,rep,0,5000                    ," July 6, 2019",5000.0,0.0
852,https://www.gofundme.com/IdeaOfEquality,"Boston, MA","The September 11th Attacks... put America on a disastrous, hyper-divisive track. It's time to UNITE and change that fact. For 17 years America has fought a war on terror overseas... that has turned into a full blown fight for The American Soul here at home. Over there... we win just about every b...",HELP SAVE THE AMERICAN DREAM!,rep,0,50.0M                    ," July 6, 2019",50000000.0,0.0
853,https://www.gofundme.com/struglling-college-student,"La Jolla, CA","I'm a student at UCSD who just recently came out as bisexual to my family who has grown up on very Republican views. As a result of severe political disagreements and shame, my family has rejected to help me pay for my college bills. I am very distressed as I had been very close to my family prio...",Coming Out College Student Disowned by Family,rep,0,1500                    ," July 5, 2019",1500.0,0.0
854,https://www.gofundme.com/democracy-or-dictatorship-the-people039s-choice,"Annapolis, MD",We can sit back and let Donald Trump and the GOP continue to destroy our country or we can do something about it.  I'm choosing to fight for Democracy and I hope you are willing to help with a small donation.  The money raised will be used to purchase and build a website.  It will not be used for...,Democracy or Dictatorship - The People's Choice,rep,0,1000                    ," July 5, 2019",1000.0,0.0
857,https://www.gofundme.com/nf5xz4-united-we-stand,"Litchfield Park, AZ","UNITED WE STAND AND PATHWAYS IS WORKING TO "" KEEP ARIZONA RED IN 2020 AND BEYOND.""     United We Stand has a district by district ground game and media campaign designed to maximize voter turnout for Republican candidates in the 2020 election by reaching out to Republicans and Independents with u...",United We Stand,rep,0,1000                    ," July 1, 2019",1000.0,0.0
858,https://www.gofundme.com/pay-the-fees-for-former-florida-felons-so-can-vote,"North Dartmouth, MA","In November, Floridians approved Amendment 4, which restored voting rights to former felons who have served their sentence, excluding those convicted of murder and sex felonies, by a landslide 30-point margin. Republican Gov. Ron DeSantis kneecapped Florida’s groundbreaking effort to expand voter...",Pay the fees for former Florida felons so can VOTE,rep,0,100000                    ," June 30, 2019",100000.0,0.0
860,https://www.gofundme.com/4qsa3-book-publishing,"Williston, FL","Hello, UFOers, Aliens in Space, Psychics, and Witches,  Please take read my Fundraiser and an Important UFO Space Signaling Message  This fundraiser is to help me publish my 1st and a very interesting book titled: Ship-Shot Haunted and A Letter from a Very Scared Earth Witch. This book is about L...",Book Publishing,rep,0,2000                    ," June 30, 2019",2000.0,0.0
861,https://www.gofundme.com/voting-decisions,"Kemah, TX","Right now, I vote Republican. I can’t afford to vote Democrat. Raising money to switch sides. Will vote straight ticket Democrat if goal is met before presidential election. Please help me reach my goal.",Voting Decisions,rep,0,5.0M                    ," June 29, 2019",5000000.0,0.0
863,https://www.gofundme.com/want-to-win-florida-buy-a-vote,"Los Angeles, CA",Florida voted to restore the voting rights of citizens who have completed their sentences and returned to society. Republican legislators have tried to frustrate that by passing laws requiring them to pay substantial fines and fees to get their right to vote back. You can help by donating to thos...,Want to win Florida? Buy a vote!,rep,0,50000                    ," June 29, 2019",50000.0,0.0
864,https://www.gofundme.com/Assist-Florida-Convicted-Pay-Fines-to-Restore-Voting-Rights,"Fort Lauderdale, FL",summary was NoneType,Florida Felon Fine Payment Restore Voting Rights’,rep,0,25.0M                    ," June 29, 2019",25000000.0,0.0
865,https://www.gofundme.com/please-help-me-pay-for-conversion-therapy,"Laveen, AZ","Hello every bright face who has came upon this, I have been conflicted with myself for years as my sexuality I’m so desperately trying to get rid of is in contrast of my political and religious views. I believe I was forced into homosexuality at a young age and now I have to bear the atrocity of...",Please help me pay for conversion therapy!!,rep,0,10000                    ," June 29, 2019",10000.0,0.0
866,https://www.gofundme.com/z35xx-hand-up-not-hand-out,"Saint James, MN",The idea is a simple one. The money will be used to help bring in businesses to give immigrants a job and programs like teaching them English to help make their transition easier. I think it's important that they're not illegal you should do it right but help them get a foothold in this country g...,Hand up not Hand out,rep,0,1.0M                    ," June 28, 2019",1000000.0,0.0
867,https://www.gofundme.com/feed-the-starving-migrant-children,"Evansville, IN","I’m making this gofundme for the children who are starving at our nations border. Democrat. Republican. I don’t care who you are. I don’t care about your politics. Both sides claim to be good people for the people, but both sides stand by and gawk like idiots at the suffering going on at our bord...",Feed The Starving Migrant Children,rep,0,10000                    ," June 27, 2019",10000.0,0.0
868,https://www.gofundme.com/Ohio-planned-parenthood-fund,"Fremont, OH",summary was NoneType,Planned Parenthood of Ohio Replacement Funding,rep,0,50000                    ," June 27, 2019",50000.0,0.0
869,https://www.gofundme.com/1oi89nboio,"Chipley, FL","I'm Tabitha McKenzie and recently felons was allowed to vote based on a bill passed by the voters of this great state. Due to the new law that Governor DeSantis signed for July 1, 2019 old fines has to be paid before I can vote or get a chance for a pardon from my past and choices I made due to a...",Making America Greater,rep,0,4000                    ," June 27, 2019",4000.0,0.0
870,https://www.gofundme.com/bring-quinley-to-mexico,"Youngwood, PA",A once in a lifetime opportunity that most queer little Chinese girls do not have the fortune to experience; a vacation with their girlfriend and her Republican mother. As the little immigrant girl cannot pay for the trip herself even though she works 40 hours a week in a small room and rarely ge...,Bring Quinley to Mexico,rep,0,1300                    ," June 26, 2019",1300.0,0.0
871,https://www.gofundme.com/Defend-Political-Speech-Online-from-Big-Tech,"Palm Beach Gardens, FL","This fund is to facilitate the creation of an organization to defend free speech on the internet, specifically to defend political speech. The vast majority of all funds are to fund litigation against technology firms, and establish a link between political parties and actions related to the cens...",Defend Political Speech Online from Big Tech,rep,0,10.0M                    ," June 26, 2019",10000000.0,0.0
873,https://www.gofundme.com/exodus-media-network,"Cincinnati, OH","I’m raising money to build the Exodus Media Network which is a network dedicated to the Truth, Conservatism,  American Exceptionalism and returning America back towards Judeo Christian Values. The Exodus Media Network is the absolute voice of the true American Conservative and as the founder of t...",Exodus Media Network,rep,0,50000                    ," June 25, 2019",50000.0,0.0
874,https://www.gofundme.com/help-protect-the-border-from-invasion-con-a4-s4,"Indianapolis, IN","USA Constitution Article 4. Section 4.  ""The United States shall guarantee to every State in this Union a Republican Form of Government, and shall protect each of them against Invasion; and on Application of the Legislature, or of the Executive (when the Legislature cannot be convened) against do...",Help Protect The Border From Invasion. Con A.4 S.4,rep,0,50000                    ," June 24, 2019",50000.0,0.0
875,https://www.gofundme.com/bernie-why-don039t-i-deserve-a-break,"Wheatland, WY","I have a passion for assisting others in some of the lowest and highest points of their life.   Spending the majority of my life on working and furthering my education, proudly obtaining my degree in nursing. I am still driven to attain my Nurse Practitioner degree. Yet, I am mystified and down r...","Bernie, why don't I deserve a Break?",rep,0,68000                    ," June 23, 2019",68000.0,0.0
876,https://www.gofundme.com/because-texas,"Corpus Christi, TX","About 3+ years ago, a good friend of mine, Jeremiah Francisco Rubio, moved to Colorado for a change of scenery with his brother.  While there Jeremiah was involved with one of the worst tragedies known to man. he allowed a Colorado tattoo artist to tat him a small state of “TEXAS” that was horrib...",BECAUSE TEXAS,rep,0,205                    ," June 22, 2019",205.0,0.0
877,https://www.gofundme.com/wnctnq-trump-2020-maga,"Charlotte, NC","Current President Donald J. Trump will be closing out his 4 year term next year and to ensure that we keep President Trump and his laws intact, we must keep Making America Great Again! Please join me and helping donate to keep the great republican party lee by Trump in office!",Trump 2020 #MAGA,rep,0,50000                    ," June 20, 2019",50000.0,0.0
878,https://www.gofundme.com/1o88f6wxlc,"Bethesda, MD","I am starting this campaign to support Donald Trump in his quest to reelection in 2020. We need him to MAKE AMERICA GREAT AGAIN AND KEEP AMERICA GREAT. I am a latina woman who has now seen the light. I was blinded by Democrats and liberals growing up. I was fed lies by the liberal media. But, now...",MINORITIES FOR TRUMP 2020,rep,0,5000                    ," June 19, 2019",5000.0,0.0
879,https://www.gofundme.com/bring-whataburger-to-texas,"Frisco, TX",We want to bring whataburger back to the place it began. Please help our support as we locate investors and individuals who can bring the rights back to the republican state it so proudly represents.,Bring Whataburger to Texas,rep,0,10.0M                    ," June 19, 2019",10000000.0,0.0
880,https://www.gofundme.com/xmeg5-make-california-great-again,"Palm Springs, CA","Let's make California great again  Together with our neighbors we've been supporting the Republican party in several ways, nevertheless, the ignorance shown by Californians does not make it possible to turn the state red, with your help, we will cross the whole state making people conscious about...",Make California Great Again,rep,0,20000                    ," June 19, 2019",20000.0,0.0
882,https://www.gofundme.com/tomilahrenatbentleyuniversity,"Waltham, MA","Please support the Bentley Republicans give conservative students at Bentley University a voice on campus and support us to our goal of $30,000 for attorney fees in regard to the assault and to host Tomi Lahren, the youngest political talk show host in history, at Bentley University  For months,...",Bring Tomi Lahren to Bentley University,rep,0,30000                    ," June 17, 2019",30000.0,0.0
883,https://www.gofundme.com/washington039s-millennial-democracy,"Oak Harbor, WA",My name is Christopher L. Reed. I'm running for the District 10 position within the Washington State Legislature.  Why do I need your money? Simple: because I'm just a self employed local man that's been running a small business for nearly two decades. While this has provided me with the ability...,Washington's Millennial Democracy,rep,0,15000                    ," June 15, 2019",15000.0,0.0
884,https://www.gofundme.com/retire-the-rino,"Celina, TX","Pay filing fees ($5000) and down payment to hire a campaign manager, an accountant and set up website, etc. to run against Republican In Name Only (RINO) U.S. Senator John Cornyn. The funds will be needed ASAP to submit application with Texas election department and get started with other prelimi...",Retire the RINO,rep,0,10000                    ," June 14, 2019",10000.0,0.0
885,https://www.gofundme.com/OMEGA-Media-Group-An-Unbiased-View-of-our-World,"Joplin, MO","I am raising money in order to start a News/Media group that has a strong emphasis on truth, fairness, independence, accountability, and humanity.  WHAT: My mission is very simple. I want to start a Media Company that relies on the 5 pillars of Journalism in order to disseminate information.   1:...",OMEGA Media Group: An Unbiased View of our World,rep,0,4500                    ," June 28, 2019",4500.0,0.0
886,https://www.gofundme.com/stephen-j-crowley-iraq-combat-vet-for-congress,"Peoria, AZ",Click Here for Official Website >> Stephen J. Crowley: Iraqi Freedom Vet for Congress   IMPORTANT! Donations over $50.00 must be accompanied by Name and Address according to Campaign Finance Law.  Candidate’s Statement               I am presently running for Congress as a Republican.  I have pro...,Stephen J. Crowley: Iraq Combat Vet for Congress,rep,0,5000                    ," June 13, 2019",5000.0,0.0
887,https://www.gofundme.com/broadcast-youth-sports-live,"Newport, NC",I've been involved with film making and Photography since I was a teenager.  I've been wanting to start my own business for several years and wasn't sure what business venture  until I picked up my camera again after a long absence. Your support will help my business become a success. I'm a Carte...,Broadcast Youth Sports Live,rep,0,4500                    ," June 12, 2019",4500.0,0.0
888,https://www.gofundme.com/bosco-for-congress-2020,"Hartsdale, NY","Fellow New Yorkers,  My name is George Bosco and I'm running for Congress in New York's District 17.  Our elected representatives spend so much time fighting each other or telling us about the problems of the country that they have little time left to actually DO something about those problems. ...",Bosco for Congress 2020,rep,0,500000                    ," June 12, 2019",500000.0,0.0
889,https://www.gofundme.com/trump039s-truth,"Glencoe, IL",Hey all - been pretty fed up w the bigotry of the Republican party and I am trying to spread some truth on the pig in whitehouse.  Pitch in a couple dollars and help me make some fun stickers that tell the true story.  Thanks!,Trump's Truth,rep,0,200                    ," June 11, 2019",200.0,0.0
890,https://www.gofundme.com/help-the-us-build-the-wall,"Grand Rapids, MI","The United States is my home! The protection of my home is important to me. After being more educated on the policies and functions of our country, I decided to change my political to be more republican. My family members are against my decision, but I know what is best for the country. Illegal i...",Help the US build the WALL!!!,rep,0,5000                    ," June 8, 2019",5000.0,0.0
891,https://www.gofundme.com/send-congress-the-mueller-report,"Philadelphia, PA","It's clearly apparent that Congress is refusing to read The Mueller Report (aside from Republican, Justin Amash).  So, let's make things easy on them -- as their constituents, it's the least we can do -- and send each member a copy!  534 members of Congress (excluding Rep Amash) x $30 per copy of...",Send Congress The Mueller Report,rep,0,16020                    ," June 8, 2019",16020.0,0.0
893,https://www.gofundme.com/raising-public-awareness,"Tampa, FL",I need financial help to increase the awareness of African Americans. Recently I was accused of being less than loyal to my race because I supported offering the option of studying the Bible in our public schools as suggested by President Trump.  The question was asked whether I was a brother bec...,Raising Public Awareness,rep,0,10000                    ," June 6, 2019",10000.0,0.0
894,https://www.gofundme.com/xbhak-trump-loves-immigrants,"Grand Rapids, MI","MISSION: TO EMPOWER THE REPUBLICAN IMMIGRANTS GOAL: TO BUILD A PLATFORM THAT WILL ATTRACT MORE PEOPLE, THIS WILL CREATE A COMMON GROUND FOR US.",TRUMP LOVES IMMIGRANTS,rep,0,1000                    ," June 6, 2019",1000.0,0.0
895,https://www.gofundme.com/roberteleestatue,"Dallas, TX","We are a  conservative -> moderate Dallas  Republican group of community organizers and our goal is the creation of two initiatives. The first is the replacement of the Robert E Lee statute that was on Turtle Creek in Dallas which is going to cost upwards of $800,000.  So we will be reaching out...",RoberTeLeeStz,rep,0,4500                    ," June 5, 2019",4500.0,0.0
896,https://www.gofundme.com/trumps-border-wall-association,"Aurora, CO",In support of president Trump and his border wall. The association is making a plan to send a message to congress.  We will be making a wall of paper bricks and presenting it to minority leader Kevin McCarthy  Everyone who donates will have there name on a brick in the colodge.  We are hoping for...,Trumps Border Wall Association,rep,0,2.0M                    ," June 5, 2019",2000000.0,0.0
897,https://www.gofundme.com/georgeholobetz4pagovernorin2022,"Hummelstown, PA",My Political Goals as Governor and My Stance 5 28 19     I am a Conservative Republican with true convictions  ·      I am Pro-Life against abortion and the death penalty and a moderate Catholic Conservative  ·      I am against raising more taxes and for determining if we can get rid of any like...,GeorgeHolobetz4PAGovernorin2022!,rep,0,1000                    ," June 4, 2019",1000.0,0.0
899,https://www.gofundme.com/campaign-fund-of-jimmy-ausbrooks,"Franklin, KY","Kentucky U S Senate race in 2020, Jimmy Ausbrooks a proud native of Kentucky is seeking the 2020 Democratic nomination for the U S. Senate race.   I am a simple man, college graduate, employed counselor that lives and works paycheck to paycheck like most Americans. I care for an aging grandmother...",Campaign Fund of Jimmy Ausbrooks,rep,0,100000                    ," June 3, 2019",100000.0,0.0
900,https://www.gofundme.com/comedians-for-democracy,"Los Angeles, CA","Election Day, 2016.   Do you remember where you were when Donald Trump became President?   I was covered in sweat and surrounded by volunteers at a Hillary Clinton MegaPhone Bank in Culver City. Just like everyone else, I thought we were welcoming in the first female President of the United State...",Comedians for Democracy,rep,0,10000                    ," June 3, 2019",10000.0,0.0
903,https://www.gofundme.com/establish-hitchens-cultural-center,"Greensboro, NC","“We have deeply held beliefs in rational thinking and science.”  Instead of just being “us,” and leading our various lives, let’s make establish our Nondelusional “church“ which is dedicated to reason and science. Here’s some commandment examples:  Members who own businesses are forbidden to serv...",Hitchens Cultural Center,rep,0,10000                    ," June 1, 2019",10000.0,0.0
905,https://www.gofundme.com/maga-conservative-news,"Tuckerton, NJ",It's time conservative republicans who support President Trump have their own MAGA Conservative News network host and entertainer covering  what's important to us.   Social media MAGA conservative activist Joseph Rudy Rullo will launch the show in Orlando at Trump 2020 reelection announcement ral...,MAGA Conservative News,rep,0,100000                    ," June 1, 2019",100000.0,0.0
